{
  "schema": "scenario_recommendations_v1",
  "created_at": "2026-03-21T00:00:00Z",
  "phaselock": "CoherenceLattice scenario formalization -> Sophia scenario audit -> Publisher stress-test docket",
  "caution": "Preparedness findings are advisory and non-executing; no automatic emergency activation or live execution authority is implied.",
  "recommendations": [
    {
      "scenarioId": "scenario:custody-tamper-chain-002",
      "scenarioStatus": "strained",
      "preparednessRecommendation": "prioritize-redundancy",
      "coherenceScore": 0.441,
      "riskScore": 0.551318,
      "captureRisk": 0.577929,
      "continuityRisk": 0.546133,
      "explanation": "Preparedness favors redundancy over concentration to reduce single-point failure risk in hypothetical conditions. scenarioId=scenario:custody-tamper-chain-002, coherence=0.441, risk=0.551, captureRisk=0.578, continuityRisk=0.546.",
      "governingRule": "redundancy-over-concentration",
      "targetPublisherAction": "docket"
    },
    {
      "scenarioId": "scenario:stacked-quorum-dispute-001",
      "scenarioStatus": "stable",
      "preparednessRecommendation": "continue",
      "coherenceScore": 0.6105,
      "riskScore": 0.437393,
      "captureRisk": 0.472929,
      "continuityRisk": 0.400633,
      "explanation": "Scenario remains stable under hypothetical stress modeling and bounded preparedness assumptions. scenarioId=scenario:stacked-quorum-dispute-001, coherence=0.611, risk=0.437, captureRisk=0.473, continuityRisk=0.401.",
      "governingRule": "stable-hypothetical-preparedness",
      "targetPublisherAction": "watch"
    }
  ]
}
